"ID","name","event","room","startTime","endTime","sessionDate","isSponsored","isActivity","tags","description","sessionSurvey","sessionsFavoritedCount","answersInputedCount","averageRates",
"164","Decoupling Content Management with Create.js","3","Parisien","15:50","16:20","2012-11-17T12:34:00.000Z",,,"Create js","The current breed of Content Management Systems is largely monolithic: if you're choosing a system based on its user experience, this will mandate the web development tools and languages to use, and often even the database where your content is persisted. Or if you choose it based on the web development tools, this will mandate the user interface and storage layers.  But now a new movement has started towards a more decoupled CMS landscape. Projects like Create and JCR spearhead it, giving CMS developers previously-unseen opportunities for cross-project collaboration.  Create is the next generation user interface for content management. It provides a fully client-side content editing experience built on tools and standards like RDFa and Backbone.js. With Create, end users can stop filling forms and start communicating with their audience.  The MIT-licensed Create library provides CMS developers with a set of widgets to easily build a modern user experience. It has been built as part of the EU-funded Interactive Knowledge Systems project, which aims to boost the state of Open Source Content Management by new tools built on semantic technologies.  This talk will explain how both Create works, and how it can be utilized in CMS development. It also shows how systems like Midgard, OpenCMS, and Symfony CMF already use the building blocks of Decoupled Content Management.","1",,"20","3.8",
"165","You want to do WHAT with JavaScript!?!","3","Parisien","16:20","16:50","2012-11-17T12:35:00.000Z",,,"JavaScript","Born in the mid 90′s as the stepdaughter of Java applets in Netscape Navigator, JavaScript has come a long way. Once used to validate forms and to dynamically change the background color of Web pages, JavaScript is now the number one citizen in the interwebs. Why? Because you can do all kinds of crazy and fascinating stuff with it! In this talk Sebastian will show what’s possible today: Video chats, controlling Arduino-based robots, wiring it all together and more… Just be surprised and follow Sebastian and JavaScript where no other programming language has gone before!","1","1","0",,
"166","Hands-on Training – Level 4 Real-time management of server push data with HTML5 Server Sent Events","3","Européen","15:10","16:50","2012-11-17T12:36:00.000Z",,,"Workshop","This workshop is presented by the Supinfo school of technology. Bring your laptop and get hands-on experience with HTML5, CSS3, JavaScript, Ajax, jQuery and more. Individual assistance will be available courtesy of Supinfo instructors. Note: Space is limited, so register now and take advantage of this workshop at no additional cost! The workshop will be given in French and in English. Four progressive levels are available, so you can enter the cycle at the point you feel best matches your technical background.","1",,"0",,
"167","Testacular – The Spectacular JavaScript Test Runner","3","France","12:00","12:30","2012-11-17T14:42:00.000Z",,,"Testing, Web Apps","This session will serve as an introduction to Testacular – a test runner that makes makes testing JavaScript applications in real browsers frictionless and enjoyable. Testing is not optional when one is building a JavaScript application that must work across many browsers and devices. However, executing tests in all of these various environments is hard. Testacular turns this typically painstaking task into a piece of cake. It allows you to execute JavaScript tests in real browsers or devices such as your phone or tablet directly from the comfort of your terminal or your favorite IDE.","1",,"0",,
"168","Augmented Reality Using a JavaScript API","3","France","12:00","12:30","2012-11-17T14:44:00.000Z",,,"Augmented Reality, HTML5, JavaScript","In this session we will cover the fundamentals of Augmented Reality on a smartphone and how to create Augmented Reality content (games, location finder,....) based on web technologies (JavaScript, CSS, HTML).","1",,"0",,
